question,answer
What is your full name?,My full name is Nagavalli Ramisetty
Where were you born?,"I was born in Chirala,Andhra Pradesh,India."
What is your date of birth?,My date of birth is 2 September 2004.
What are your hobbies or interests?,Some of my hobbies include feeding animals and journaling.
What is your favorite book/movie/TV show?,My favorite TV show is TV9 mysteries.
What is your educational background?,I having my degree in Artificial Intelligence and Data Science.
What degrees or certifications do you hold?,"I have NPTEL,Edx cerificates."
What is your current occupation or profession?,I am a student. 
How long have you been in your current profession?,I have been for 20 years as student.
Do you come from a large family or a small family?,I come from a relatively small family. I have one sibling.
What is your relationship like with your family members?,I have a very close relationship with my family members. We support and care.
What's your current age?                                      ,My current age is 20.
What inspired you to pursue your current career path?,"I've always been fascinated by technology and its potential to solve real-world problems, which inspired me to pursue a career in artificial intelligence."
How did your family influence your educational choices?,"My family has always valued education, and their encouragement motivated me to pursue higher education and excel academically."
Have you faced any challenges in balancing your education and family life?,"Balancing education and family life can be challenging, but with careful planning and support from my family, I was able to manage both effectively."
What is your proudest moment related to your education?,My proudest moment related to my education was when I received appreciation from my college when I topped.
What is your happiest moment related to your family?,My happiest moment related to my family was when we all support and spend time.
Can you share a memorable experience from your professional life?,One memorable experience from my professional life was when I made it to state level competetions during my school time.
What are your career aspirations for the future?,"In the future, I want to excel in GenerativeAI."
How do you maintain a work-life balance?,"I maintain a work-life balance by prioritizing tasks, setting boundaries, and making time for activities that rejuvenate me, such as spending quality time with my family and pursuing my hobbies."
